{
  "candidates": [
    {
      "branch": {
        "cfg_block_index": 3,
        "cfg_record_index": 1,
        "operation_address": "00a45b87",
        "operation_time": 86,
        "pcode_flow_record_index": 22,
        "successor_block_indices": [
          4,
          5
        ],
        "write_reachable_successor_index": 4
      },
      "candidate_id": "4d7d076e8f78c10adb94791c62fb6cffd6614442124352deabeea3f070f3a352",
      "comparison": {
        "opcode": "INT_NOTEQUAL",
        "operation_address": "00a45b85",
        "operation_time": 80,
        "pcode_flow_record_index": 21
      },
      "field": {
        "offset_bytes": 0,
        "root_parameter_index": 3
      },
      "function_entry": "00a45b50",
      "load": {
        "operation_address": "00a45b83",
        "operation_time": 73,
        "parameter_load_record_index": 4,
        "pcode_flow_record_index": 20
      },
      "reason_codes": [
        "parameter_field_load_directly_compared",
        "comparison_result_controls_conditional_branch",
        "same_parameter_offset_store_reachable_from_one_successor"
      ],
      "write": {
        "cfg_block_index": 4,
        "cfg_record_index": 1,
        "memory_store_record_index": 5,
        "operation_address": "00a45b8f",
        "operation_time": 91,
        "pcode_flow_record_index": 26
      }
    }
  ],
  "claim_scope": "Single-function structural candidate only; no state semantics, branch truth polarity, path feasibility, or runtime value-flow claim.",
  "format": "REVENGINSTR.StateMachineCandidateAudit/2",
  "program_id": "nfs-shift:SHIFT.exe",
  "selected_function_entries": [
    "00a45b50"
  ],
  "source": {
    "candidate_count": 1,
    "cfg_sha256": "3b32064c4268a74c2147cef5f4e3bbc7cf14864e5c99244a91df51ebe4f638d0",
    "function_count": 1,
    "memory_store_rows": 8,
    "memory_store_sha256": "0a7f889727e1daa6eac95752a419b427834a964d6190803ce66acf412deb6b3a",
    "parameter_load_rows": 6,
    "parameter_load_sha256": "fc7cf6b37a21c8859e1e95c67aad6c9a5d052838d55300b4d05606890478ed5a",
    "pcode_flow_sha256": "5da44d69a7fde99ca622eec018f5e6bdbbc7fd74d604a47a1f6f3bf6518cbf2b",
    "pcode_operations": 68,
    "unresolved_store_rows": 1
  }
}
