{
  "candidates": [],
  "claim_scope": "Single-function structural candidate only; no state semantics, branch truth polarity, path feasibility, or runtime value-flow claim.",
  "format": "REVENGINSTR.StateMachineCandidateAudit/2",
  "program_id": "nfs-shift:SHIFT.exe",
  "selected_function_entries": [
    "00503790"
  ],
  "source": {
    "candidate_count": 0,
    "cfg_sha256": "990934e62314f4f41a9dde247a941f55975ecc857060b073a92bea5e78f15632",
    "function_count": 1,
    "memory_store_rows": 7,
    "memory_store_sha256": "b565a5e63924f5a902b814ee568c08d6d79b2ec0ae079c78982aad26c8298aee",
    "parameter_load_rows": 2,
    "parameter_load_sha256": "3713ad8bbd5f5ceac28d5416cff8783dcf9c42ba142aa4888f7dac2cfdbc7e04",
    "pcode_flow_sha256": "fc480c131c8b7871def5c35acfaefa9b514dc2511a43700e70a9f8bb338505a4",
    "pcode_operations": 43,
    "unresolved_store_rows": 0
  }
}
