{
  "candidates": [],
  "claim_scope": "Single-function structural candidate only; no state semantics, branch truth polarity, path feasibility, or runtime value-flow claim.",
  "format": "REVENGINSTR.StateMachineCandidateAudit/2",
  "program_id": "nfs-shift:SHIFT.exe",
  "selected_function_entries": [
    "009cf690"
  ],
  "source": {
    "candidate_count": 0,
    "cfg_sha256": "9ba2a65b4c5553aec11007809806994c409d002652e1420243de6db68ab5c85d",
    "function_count": 1,
    "memory_store_rows": 6,
    "memory_store_sha256": "8382b4c2013f3de51f52cebba2eb063701b3d50d6399b93c73884538e9dce9a2",
    "parameter_load_rows": 17,
    "parameter_load_sha256": "a270c31460ed5ba178e70adaa5a9d064a1d68082ace91ddd66ae9a051aca3ee7",
    "pcode_flow_sha256": "c3bd38fa8f2be0fbc7b34c66027b302c9e82533ff413574eac85605d3721da21",
    "pcode_operations": 237,
    "unresolved_store_rows": 0
  }
}
