{
  "candidates": [],
  "claim_scope": "Single-function structural candidate only; no state semantics, branch truth polarity, path feasibility, or runtime value-flow claim.",
  "format": "REVENGINSTR.StateMachineCandidateAudit/2",
  "program_id": "nfs-shift:SHIFT.exe",
  "selected_function_entries": [
    "00a3d3c0"
  ],
  "source": {
    "candidate_count": 0,
    "cfg_sha256": "3cb4db348af62f798c17853d0a21c4a044554b8c77b59f8c1a3cb9eb053e00da",
    "function_count": 1,
    "memory_store_rows": 67,
    "memory_store_sha256": "4647bd926ec7e98e43e7e1b2e7fca116c6d6264e0f9e67aea55183789ff2fa7f",
    "parameter_load_rows": 3,
    "parameter_load_sha256": "27f8e52961d345d1cddd2fbc8cc076d3bbf57a0888ee0112774b1ffcc694a98d",
    "pcode_flow_sha256": "b6eacd779d6914f9583e4e2e1bf6c6c6c233f32e49875e8a7c5e1d2375a0af0e",
    "pcode_operations": 500,
    "unresolved_store_rows": 0
  }
}
